Job Title,Salary Estimate,Company Name,Location,Job Description,Rating,Size,Founded,Type of ownership,Industry,Sector,Revenue
Data Engineer,$80.00 - $85.00 Per Hour (Employer est.),"3G Federal Solutions, LLC",Remote,"Re-opening for additional resume submissions. Minimum requirements HM is looking for:
1. Hands-on data engineering skills using Python and related programming skills
2. Demonstrated data transformation skills converting variety of unstructured data to structured data for analytics including experience in parser development, multi-modality extraction capabilities
3. Must have Data Engineering/solutioning experience in designing, developing, and implementing cloud-based data analytical solutions using more than 2 of the following Azure Products:
Azure Data Factory, Azure Analysis Services, Azure DataBricks (PySpark), Azure Machine Learning, Azure Storage/Data Lakes
4. Traditional BI experience in SQL Server Stack including writing complex T-SQL stored procedures; use of SSIS to develop and deploy complex SSIS Packages across multiple-environments; data migration experience
5. Data modeling and visualization experience using Power BI /DAX programming experience is highly preferred
We are looking for Data Engineers to support operationalizing Security Governance and Risk (SG&R) Division`s Data Analytics Programs. The ideal candidate for this position with source, evaluate, and prepare data assets for easier access and use by data consumers and stakeholders. The person hired for this role will be part of a team that will help implement a modern end-toend data analytics infrastructure that enable data-centric risk decisioning.
Responsibilities
Implement and manage data transformations needed by customer (e.g., Analytics team, Data Scientists, ML Modelers)
Closely work with Data Architect(s) to build functional capabilities and analytical tools and needed to realize data architecture goals
Improve/automate internal processes for optimal data delivery and mature infrastructure for greater scalability and functionality
Confirm all data pipelines and data flows are operational and well-functioning
Implement data quality checks to maintain data integrity and monitor for high data quality
Provide support to assigned department; may work on small projects or portions of larger projects
Support business strategy and initiatives within the business unit and/or across the organization
Assist and collaborate with various levels of staff to accomplish tasks/assignments
Perform research and analysis; may include quantitative and/or qualitative analysis
Maintain professionalism in all interactions, placing member service as priority
Support comprehensive day-to-day
Qualifications
Must have a bachelor’s degree in Information Science, Data Analytics, Information Management, or Computer Science or 5+ years of experience in a directly related role with progressive growth
Proven experience as a data engineer with experiences in designing and building analytical solutions. Specifically, handson experience in setting up data pipelines for data science and machine learning projects.
Proficiency with Python in a data engineering context. E.g., Pandas, PySpark, PyTorch
Experience in cloud-based data products and solutions such as: Azure Data Factory, Azure Synapse, Azure SQL, Azure Data Lake, and Azure App Service
Exposure to data/collaboration tools such as MS SharePoint, MS Power BI, MS Power Platform, Service Now, GRC applications, and related Azure Cloud Technology/Products
Significant experience in handling unstructured datasets and converting them into Structured datasets
Effective interpersonal, verbal, and written communication skills
Effective research, analytical, and problem-solving skills
Effective skill maintaining accuracy with attention to detail and meeting deadlines
Provide exceptional Customer Service support
Preferred Qualifications
Experience in designing and hands-on development in cloud-based analytics solutions
Proficiency with Python in a data engineering context. E.g., Pandas, PySpark, PyTorch
Experience with multiple programming languages, including Python, R, MATLAB, or SAS • Hands-on experience in modern Data Platforms related technologies such as Azure Synapse, Azure SQL Azure Databricks and Power BI (including using DAX) is desirable
Strong knowledge of Microsoft BI Stack (SSRS/SSAS (Tabular with DAX & OLAP with MDX) SSIS)
Strong understanding of NoSQL implementation (Mongo, Cosmos DB or other similar tools)
Designing and building of data pipelines using API ingestion and other ingestion methods (batch and real-time)
Knowledge of Dev-Ops processes (including CI/CD) and use of source control software such as Git or GitHub is essential
Experience in metadata management and data governance tools and processes (e.g., Microsoft Purview, Collibra, Informatica, Talend) is desirable
Strong experience in common data warehouse modelling principles including Kimball, Inmon is desirable
Ability to easily converse with Data Scientists, ML Modelers, and Data Engineers on various data analytical concepts and statistical modeling technique (e.g., regression, logistic regression, log-linear regression) is desirable
Strong academic background or experiences in Security-related domain and/or banking Industry is desirable
Excellent knowledge and passion for cloud computing technologies and current computing trends
Job Type: Contract
Pay: $80.00 - $85.00 per hour
Experience level:
10 years
Schedule:
Monday to Friday
Work Location: In person
Show Less
Report",-1,1 to 50 Employees,-1,Company - Public,-1,-1,Unknown / Non-Applicable
Data Engineer/MACHINE LEARNING,$60.00 - $70.00 Per Hour (Employer est.),TellusSolutions3.7 ★,"Sunnyvale, CA","Job Description:
The role will be responsible for expanding and optimizing our data and data pipeline architecture, as well as optimizing data flow and collection for cross functional teams.
The ideal candidate is an experienced data pipeline builder and data wrangler who enjoy optimizing data systems and building them from the ground up.
The Data Engineer will support our software developers, database architects, and data analysts and data scientists on data initiatives and will ensure optimal data delivery architecture is consistent throughout ongoing projects. They must be self-directed and comfortable supporting the data needs of multiple teams, systems and products.
The right candidate will be excited by the prospect of optimizing or even re-designing our data architecture to support our next generation of products and data initiatives.
Responsibilities:
Create and maintain optimal data pipeline architecture for data intensive applications.
Assemble large, complex data sets that meet functional / non-functional business requirements.
Identify, design, and implement internal process improvements: automating manual processes, optimizing data delivery, re-designing infrastructure for greater scalability, etc.
Build the infrastructure required for optimal extraction, transformation, and loading of data from a wide variety of data sources using Azure SQL, Cosmo DB, Databricks and other legacy databases.
Build analytics tools that utilize the data pipeline to provide actionable insights into customer acquisition, operational efficiency and other key business performance metrics.
Work with stakeholders including the Executive, Product, Data and Design teams to assist with data-related technical issues and support their data infrastructure needs.
Keep our data separated and secure across national boundaries through multiple data centers and Azure regions.
Create data tools for analytics and data scientist team members that assist them in building and optimizing our product into an innovative industry leader.
Work with data and analytics experts to strive for greater functionality in our data systems.
Qualifications for Data Engineer
Advanced working SQL knowledge and experience working with relational databases, query authoring (SQL) as well as working familiarity with a variety of databases.
Extensive Experience on Databricks on Azure Cloud platform, deep understanding on Delta lake, Lake House Architecture.
Programming experience on Python, Shell scripting, PySpark, and other data programming language.
Experience performing root cause analysis on internal and external data and processes to answer specific business questions and identify opportunities for improvement.
Strong analytic skills related to working with Data Visualization Dashboard, Metrics and etc.
Build processes supporting data transformation, data structures, metadata, dependency and workload management.
Skills:
A successful history of manipulating, processing and extracting value from large disconnected datasets.
Working knowledge of message queuing, stream processing, and highly scalable 'big data' data stores.
Familiar with Deployment tool like Docker and building CI/CD pipelines.
Experience supporting and working with cross-functional teams in a dynamic environment.
8+ years' experience in software development, Data engineering, and
Bachelor's degree in computer science, Statistics, Informatics, Information Systems or another quantitative field. Postgraduate/master's degree is preferred.
Experience in Machine Learning and Data Modeling is a plus.
Job Type: Contract
Pay: $60.00 - $70.00 per hour
Benefits:
401(k)
Dental insurance
Vision insurance
Compensation package:
Hourly pay
Schedule:
8 hour shift
Ability to commute/relocate:
Sunnyvale, CA 94086: Reliably commute or planning to relocate before starting work (Required)
Experience:
Python: 1 year (Preferred)
SQL: 1 year (Preferred)
Work Location: In person
Show Less
Report",3.7,51 to 200 Employees,2006,Company - Private,Information Technology Support Services,Information Technology,$5 to $25 million (USD)
Data Architect,$160K - $230K (Employer est.),Appcues4.9 ★,Remote,"Your work as Appcues’ Data Architect will empower thousands of Appcues customers to improve their SaaS products’ adoption and engagement for millions of their end-users. Appcues’ no-code tools have helped customers deliver over 1.4 billion in-app web and mobile experiences such as onboarding guides, tips, announcements, and surveys. Our customers, such as Fullstory, Lyft, and Twilio, depend on our services to deliver these in-app experiences. Your mission will be to evolve our platform’s data architecture to support several new product initiatives and new products. You will collaborate closely with our product team and platform engineers to gather requirements, design and implement foundational changes that will power Appcues for years.
Tools we use
We store data in PostgreSQL, DynamoDB, S3, Redis, and Snowflake. We operate data pipelines and event streams using Kafka and SQS.
We manage, monitor, and deploy code using CircleCI, Terraform, and AWS CodeDeploy, CloudFormation, DataDog.
Our platform is powered using Elixir, Node running on Lambdas, ECS, and EC2.
Our engineers communicate primarily via Slack, and are committed to remote, agile development using Kanban.
About the role
Our fully remote engineering team currently has over 45 people. As Data Architect you will work closely with our Platform engineering teams to define our data platform and collaborate with the team on implementation.
Our data model is currently defined in Snowflake, DynamoDB and Postgres and is optimized for delivering experiences embedded in our customers' SaaS applications. Your goal will be to evolve that data model to support additional use cases and products.
Our platform handles over a billion requests from our customer sites per day via our JavaScript and mobile SDKs and from partners like Segment.io and Zapier. It also includes services that process customer rules for personalization, segmentation, and targeting.
You will evolve our data model using domain-driven design and other strategies to support our product and business objectives and adapt to current constraints.
On a typical day, you may work with our product managers to understand our business’ data model and future goals, collaborate with frontend and backend teams on constraints and needs, publish models, write technical proposals, architect solutions, work with tech leads to break epics, implement features, or mentor others.
You'll be involved in all research & development, including discovery and testing of new features and products. You will work with engineers, designers, and product managers to discover solutions, including identifying and mitigating any feasibility risks.
You will select and propose suitable database technologies to meet our business objectives including defining ETL processes for data transformation.
Work closely with the Security and Compliance team on data security measures and on ensuring compliance with regulations and data governance frameworks.
Become an expert on the data Appcues needs for products, integrations, and customers to be successful.
About you
You have designed, built and evolved significant data models to support the rapid growth of large distributed applications and product activity / analytics data. You have excellent judgment across multiple database implementations, including columnar, relational and streaming database technologies. You are pragmatic, not dogmatic, and are aware of the strengths & weaknesses of your tools.
You have deep experience using Snowflake and AWS database stacks. You are an expert in domain-driven design and data modeling, and proficient in data transformation, performance tuning, and data warehousing.
You are comfortable influencing cross-team practices, and tools by rolling up your sleeves and showing how things can improve. You can clearly describe the business implications of your technical decisions. You are excited to develop a vision & future technical roadmap of a data platform.
You enjoy mentoring other engineers and helping them grow technically. You often have become a key go-to person in your company, even on projects outside your project area.
You have led the delivery of data platform initiatives for B2B SaaS applications with significant analytics needs. For example, systems that have ingested and processed data at significant scale, managed elastic workloads using queue/worker or streaming architectures, and power the visualization of millions of data points.
While our company supports remote work, we require your availability for team collaboration during the core hours of 10 am to 4 pm Eastern Time.
You are energized working in a highly collaborative environment at a customer-driven startup.
Note - Appcues uses a market-data driven approach to setting compensation ranges, and pins compensation ranges to data provided by third-party organizations. This range is for all US-based candidates and is built to be competitive nationwide by utilizing ranges for the Greater Boston area, regardless of where in the US an employee lives (or later relocates). This range represents salary-based compensation and does not include our equity package (in stock options), 401k match, or other benefits including an office setup budget, tech budget, training and education budget, and co-working space reimbursements. Actual compensation offered to a successful applicant may be based on job-related experience and other factors consistent with applicable law. For non-US based candidates, Appcues adjusts salary ranges based on cost of labor in each market. If you have questions on the pay range in your country, the recruiter will be happy to discuss specifics during your introductory conversation.""

About Us

Appcues' mission is to help teams deliver experiences their users love. Our vision is for every software company to embrace product-led growth, resulting in more engaged and happier users.

Our Benefits

100% remote - We don’t have an office so all of our employees learn and collaborate in the same way using remote work practices. This won't change post-COVID as we are committed to being 100% remote for the long-term. We work in Slack, Zoom, and a collection of modern collaboration tools. We have inclusive remote events and we get together annually for a fun off-site retreat.
Well-being - You'll have solid health, dental, and vision plans; access to 401k, and a generous maternity and paternity leave.
Fair pay - Each role has a defined salary band, bands and salaries are audited on a regular basis to help maintain fairness and market value
Home office and tech budget - Besides paying for your work computer (Mac or PC), we offer a one-time $1000 home office stipend and an additional $500 annual budget for extra work-related technology.
Coworking space, on us - Home office not cutting it? We'll reimburse your monthly coworking fees.
Equity - We want everyone invested in our success. We grant every employee equity in the company.
Transparency and collaboration - We foster team alignment with meetings of all shapes and sizes—a monthly all-hands meeting called FirstThurs, weekly team lunches, and Lunch & Learns., and an annual learning stipend.
Flexible Time Off - We believe time away to reflect and explore makes us all more productive, so employees don’t accrue vacation time – they work with their managers to schedule time off when they need it, consistent with our Flexible Time Off policy. Employees based in the USA also take off all US federal holidays. Employees residing in other countries can choose to follow their local national holidays or US federal holidays.
Show Less
Report",4.9,1 to 50 Employees,2014,Company - Private,Internet & Web Services,Information Technology,Unknown / Non-Applicable
"Data Engineer, National",-1,Make-A-Wish Foundation of America4.0 ★,United States,"At Make-A-Wish® America, we are more than a great place to work — our work is life-changing. Together, we create life-changing wishes for children with critical illnesses. Nearly 40 years ago the inspiration for Make-A-Wish began with one little boy's wish to be a police officer. Today, together with our volunteers, donors, staff and supporters, Make-A-Wish has granted more than 500,000 life-changing wishes and transformed countless lives.

THE TEAM
Make-A-Wish America is the national headquarters for our organization, providing resources and support for our 58 Chapters around the country. The Information Technology team is comprised of a diverse team of technologists responsible for building and operating the technologies that enable Make-A-Wish to grant the wish of every eligible child. The Information Technology team is focused on providing innovative solutions across these key areas: Operations, Security, Applications, Infrastructure, Governance, and Analytics.

THE ROLE
The Data Engineer is to expand the company’s use of data as an enabler of corporate goals and objectives. The Data Engineer will achieve this by designing, developing, and implementing data models for enterprise-level applications and systems. This individual will act as the primary advocate of data modeling methodologies.

WHERE YOU COME IN
As the Data Engineer you will:
Collaborate with project managers and business unit leaders for all projects involving enterprise data. Act as an advocate of data management
Assess and determine governance, stewardship, and frameworks for managing data across the organization.
Develop and promote data management methodologies and standards.
Identify and address inefficiencies and gaps in systems integration, compatibility, and multi-platform integrations.
Oversee the mapping of data sources, data movement, interfaces, and analytics, with the goal of ensuring data quality.
Document the data architecture and environment in order to maintain a current and accurate view of the larger data picture.
Identify and develop opportunities for data reuse, migration, or retirement.
Develop, implement, and maintain change control and testing processes for modifications to databases.

WHAT YOU’LL NEED
College diploma or university degree in computer science, information systems, or computer engineering is highly desired.
Certifications are highly desired.
4+ years of work experience as a data architect, or database administrator, or data modeler, or similar.
College diploma or university degree in computer science, information systems, or computer engineering is highly desired.
Certifications are highly desired.
SQL experience working with data and programming (Queries, Functions, Stored Procedures) is a must.
Strong understanding of relational data structures, theories, principles, and practices.
Hands-on knowledge of enterprise repository tools, data modeling tools, data mapping tools, and data profiling tools.
Experience with data processing flowcharting techniques.

WHAT WE OFFER
BENEFITS
Competitive compensation with annual incentive potential
Comprehensive benefit package: Medical, Vision*, Dental*, Wellness
Health Savings Account and Flexible Spending Account Options
Health Reimbursement Account fully funded by Make-A-Wish
Short Term Disability*, Long Term Disability* and Life Insurance
Additional Insurance Plans: Accident, Critical Illness, Hospital Indemnity, Pet Insurance through Figo
401(k) Retirement Savings Plan with 5% match after one year of service

TIME OFF
Up to 15 PTO days
10 Sick Days
11 Paid Holidays
2 Volunteer Days after one year of service
2 Personal Days accrued annually
Maternity Leave
ALSO...
Employee Awards and Recognition Programs
Individual and Leadership Development
Discounts and special offers for theme parks, events, hotels, concerts, and movie tickets
Monthly premiums paid for the employee for vision, dental, and short/long term disability.

Diversity, Equity & Inclusion Vision
Make-A-Wish is committed to championing diversity, equity and inclusion, fostering an organization that is accessible and welcoming. In turn, we are uniting communities to help make more wishes possible.
Our mission is most effectively fulfilled through a commitment to diversity, equity and inclusion as core values and practice.
It is only through our mosaic of different cultures, perspectives and experiences that we can grant life-changing wishes to every eligible child.
As the world’s largest wish-granting organization we stand against racism and intolerance and are committed to representation and acceptance, creating a sense of belonging, and practicing fairness in creating opportunities for our wish families, volunteers and staff.

We respect and ensure equal opportunity, regardless of race, religion, ethnicity, national origin, age, gender identity, sexual orientation, disability, perceived disability and other legally protected characteristics. Make-A-Wish America utilizes E-Verify in its hiring practices to achieve a lawful workforce.
Show Less
Report",4.0,1001 to 5000 Employees,1980,Nonprofit Organization,Civic & Social Services,Nonprofit & NGO,$25 to $100 million (USD)
