Job Title,Salary Estimate,Company Name,Location,Job Description,Rating,Size,Founded,Type of ownership,Industry,Sector,Revenue
AI Engineer,$95K - $138K (Glassdoor est.),MIT Lincoln Laboratory4.2 ★,"Lexington, MA","AI Technology Group (Group 01) Group 01, Artificial Intelligence (AI) Technology, is seeking 4 to 5 staff members to join the group. This is an exciting opportunity for qualified candidates looking to deepen their experience and apply their skills as they participate in research and development focused on Lincoln Laboratory’s contributions to AI in support of national security. Group 01 develops fundamental, cross-cutting, and enabling AI technologies to solve complex challenges and advance AI for the nation. In close collaboration with groups across the Laboratory and with the academic community, especially MIT, our research team is working at the frontier in AI research. We are looking for candidates at all levels (Senior Staff, Technical Staff, Associate Staff, and Assistant Staff) with AI and Machine Learning expertise and interest.

Staff will work closely with our interdisciplinary research team and with academic collaborators to gain exposure to a large breadth of research topics relevant to mission needs across the Laboratoy. Staff will be encouraged and have the opportunity to publish academic papers and gain valuable experience in AI, while pushing the state of the art in intelligent and learning systems. Significant opportunities are also available for developing AI/ML-based software systems, delivering AI training courses to DoD/IC sponsors and Laboratory staff, and acting as trusted technical advisors to the government. We are looking for staff at all levels with machine learning expertise / interest in the following areas:

Pursue knowledge-informed approaches to Machine Learning
Develop algorithms that incorporate models derived from math, physical sciences, social sciences, and human knowledge to make Machine Learning systems more accurate, data-efficient, more compute efficient, and more robust.
Develop technologies to address AI robustness, resilience, trust, and ethics
Develop algorithms that are safe, fair, explainable, and reliable, and develop evaluation methodologies for verifying these properties to enhance the trustworthiness of individual models and AI systems with a focus on DoD/IC-specific data modalities.
Reinforcement learning and autonomy
Develop algorithms, experiments, and prototypes in the area of sequential decision-making for battle management and autonomous systems with a focus on safety in complex autonomous systems.
AI software engineering
Develop frameworks and toolboxes to make AI tools more accessible to the Lincoln Laboratory community and to sponsors.

Candidates should be proficient with the Python ecosystem of machine learning libraries, have experience with software development management tools (JIRA, Git), and have exposure to a variety of machine learning techniques. Specific experience with deep learning techniques applied is preferred.

For Benefits Information, click http://hrweb.mit.edu/benefits

Selected candidate will be subject to a pre-employment background investigation and must be able to obtain and maintain a Secret level DoD security clearance.

To safeguard our health and well-being, MIT Lincoln Laboratory requires COVID-19 vaccination for all employees. Individuals may request exemption from the vaccine requirement for medical or religious reason. MIT Lincoln Laboratory is an Equal Employment Opportunity (EEO) employer. All qualified applicants will receive consideration for employment and will not be discriminated against on the basis of race, color, religion, sex, sexual orientation, gender identity, national origin, age, veteran status, disability status, or genetic information; U.S. citizenship is required.
Job Description
For Benefits Information, click http://hrweb.mit.edu/benefits

Selected candidate will be subject to a pre-employment background investigation and must be able to obtain and maintain a Secret level DoD security clearance.

To safeguard our health and well-being, MIT Lincoln Laboratory requires COVID-19 vaccination for all employees. Individuals may request exemption from the vaccine requirement for medical or religious reason. MIT Lincoln Laboratory is an Equal Employment Opportunity (EEO) employer. All qualified applicants will receive consideration for employment and will not be discriminated against on the basis of race, color, religion, sex, sexual orientation, gender identity, national origin, age, veteran status, disability status, or genetic information; U.S. citizenship is required.
To apply to this job, click Apply Now
Show Less
Report",4.2,1001 to 5000 Employees,1951,Nonprofit Organization,Aerospace & Defense,Aerospace & Defense,Unknown / Non-Applicable
Machine Learning Research Engineer,$135K - $191K (Glassdoor est.),Video.io,"San Francisco, CA","San Francisco | Mountain View | Remote
About the Role
Video.io is looking for passionate software engineers to join us and help contribute to our machine learning platform for video. You will
Build highly-scalable classifiers, tools, models and algorithms leveraging cutting-edge machine learning and computer vision technologies.
Collaborate with the teams to create a high performance and robust video product.
Deliver high quality work on schedule.
Qualifications
BS/MS degree in Computer Science or equivalent majors with 2+ years of ML or computer vision experience.
Good understanding of software development principles, capabilities and scalability.
Good understanding of data structures and algorithms.
Good team communication and collaboration skills.
Passion for solving hard productionization challenges.
Show Less
Report",-1,1 to 50 Employees,-1,Company - Private,-1,-1,Unknown / Non-Applicable
"Senior Staff Software Engineer, Machine Learning",$237K - $279K (Employer est.),Coinbase3.7 ★,Remote,"At Coinbase, our mission is to increase economic freedom around the world, and we couldn’t do this without hiring the best people. We’re a group of hard-working overachievers who are deeply focused on building the future of finance and Web3 for our users across the globe, whether they’re trading, storing, staking or using crypto. Know those people who always lead the group project? That’s us.
There are a few things we look for across all hires we make at Coinbase, regardless of role or team. First, we look for candidates who will thrive in a culture like ours, where we default to trust, embrace feedback, and disrupt ourselves. Second, we expect all employees to commit to our mission-focused approach to our work. Finally, we seek people who are excited to learn about and live crypto, because those are the folks who enjoy the intense moments in our sprint and recharge work culture. We’re a remote-first company looking to hire the absolute best talent all over the world.
Ready to #LiveCrypto? Who you are:
You’ve got positive energy. You’re optimistic about the future and determined to get there.
You’re never tired of learning. You want to be a pro in bleeding edge tech like DeFi, NFTs, DAOs, and Web 3.0.
You appreciate direct communication. You’re both an active communicator and an eager listener - because let’s face it, you can’t have one without the other. You’re cool with candid feedback and see every setback as an opportunity to grow.
You can pivot on the fly. Crypto is constantly evolving, so our priorities do, too. What you worked on last month may not be what you work on today, and that excites you. You’re not looking for a boring job.
You have a “can do” attitude. Our teams create high-quality work on quick timelines. Owning a problem doesn’t scare you, but rather empowers you to take 100% responsibility for achieving our mission.
You want to be part of a winning team. We’re stronger together, and you’re a person who embraces being pushed out of your comfort zone.
The Coinbase Machine Learning team is committed to developing sophisticated ML models that make our platform more secure, expand usage of Coinbase through personalized recommendations, and improve the user experience for our customers. Our Mission is to keep building scalable, adaptive, blockchain aware ML systems that enable Coinbase to effectively manage risk for its products and continue to build trust and engagement with its users.
What you’ll be doing (ie. job duties):
Upscale our ML models starting with our Recommendation Platform, but expanding the scope to other ML use cases
Guide the output of a team of 5-15 other ML Engineers
Work directly with product partners to identify and solve new use cases for the ML on blockchain.
What we look for in you (ie. job requirements):
MS in Machine Learning (PhD preferred)
10+ years of experience (or PhD+7)
Expert in latest ML techniques (e.g. supervised and unsupervised learning, deep neural nets, reinforcement learning, transformers)
Expert in coding on ML platforms (e.g. Tensorflow, pytorch)
Capable of architecting and owning foundational and reusable ML blocks that can accelerate the rest of the team.
Nice to Have:
Preferred: Domain expertise in RecSys (recommendation systems)

Job #: GML07NA

Pay Transparency Notice: Depending on your work location, the target annual salary for this position can range as detailed below. Full time offers from Coinbase also include target bonus + target equity + benefits (including medical, dental, vision and 401(k)).
Pay Range:
$236,725—$278,500 USD
Commitment to Equal Opportunity
Coinbase is committed to diversity in its workforce and is proud to be an Equal Opportunity Employer. All qualified applicants will receive consideration for employment without regard to race, color, religion, creed, gender, national origin, age, disability, veteran status, sex, gender expression or identity, sexual orientation or any other basis protected by applicable law. Coinbase will also consider for employment qualified applicants with criminal histories in a manner consistent with applicable federal, state and local law. For US applicants, you may view Pay Transparency, Employee Rights and Know Your Rights notices by clicking on their corresponding links. Additionally, Coinbase participates in the E-Verify program in certain locations, as required by law.
Coinbase is also committed to providing reasonable accommodations to individuals with disabilities. If you need a reasonable accommodation because of a disability for any part of the employment process, please send an e-mail to accommodations[at]coinbase.com and let us know the nature of your request and your contact information. For quick access to screen reading technology compatible with this site click here to download a free compatible screen reader (free step by step tutorial can be found here).
Global Data Privacy Notice for Job Candidates and Applicants
Depending on your location, the General Data Protection Regulation (GDPR) and California Consumer Privacy Act (CCPA) may regulate the way we manage the data of job applicants. Our full notice outlining how data will be processed as part of the application procedure for applicable locations is available here. By submitting your application, you are agreeing to our use and processing of your data as required. For US applicants only, by submitting your application you are agreeing to arbitration of disputes as outlined here.

Benefits at Coinbase
Medical Plan, Dental and Vision Plan with generous employee contributions
Health Savings Account with company contributions each pay period
Disability and Life Insurance
401(k) plan with company match
Wellness Stipend
Mobile/Internet Reimbursement
Remote-First Stipend
Connections Stipend
Volunteer Time Off
Fertility Counseling and Benefits
18 weeks paid Parental Leave
The option of getting paid in digital currency
Learn more about our mission
Show Less
Report",3.7,501 to 1000 Employees,2012,Company - Public,Internet & Web Services,Information Technology,Unknown / Non-Applicable
Data Scientist ML Engineering TMI,-1,MD Anderson Cancer Center4.1 ★,"Houston, TX","The primary purpose of the Data Scientist position is to provide support for research scientists in the development, validation, and deployment of high-quality machine learning as part of the Tumor Measurements Initiative (TMI) . In this role, the candidates will focus on the following areas:

***Ideal candidates will have experience with Azure, and proficiency in cloud-native tools and services such as Azure Arc, Azure ML and Azure Cognitive Compute (or similar).***

Support developing and translating state-of-the-art machine learning algorithms, following best practices and standards.
Oversee the lifecycle of AI models, encompassing training, evaluation, deployment, monitoring, and maintenance of algorithms.
Maintain diligent records of model development experiments, data and model lineage tracking, and create comprehensive model scorecards.
Provide rigorous testing, versioning, and documentation, ensuring impact, risk mitigation, and reproducibility.
Collaboration with ML Ops Engineers to enable rapid experimentation and impact by creating data and ML pipelines, automated testing, rapid deployments, and model monitoring.
Develop and support a culture responsible AI by minimizing bias, enhancing fairness, and maximizing transparency in AI models.
Educate and train research data scientists on ML engineering best practices and responsible AI practices.
Engage with stakeholders to gather requirements, convey AI concepts understandably, incorporate feedback, and ensure sustainable impact.

Technical Expertise
Train and deploy production quality machine learning models regularly
Apply deep learning, computer vision, and generative AI methods.
Design, develop, and maintain scalable data pipelines, feature management, data labeling, ML artifact management, and analytics
Manage data, code, and models (e.g. using Git, HuggingFace, MLFlow, or other tools.)
Work with Docker, Kubernetes, and other containerization technologies
Leverage on-premise, cloud-based, and hybrid computing environments.
Develop and implement methods and tools to quantitatively evaluate bias, fairness, and equity

Analytical Skills
Perform testing, debugging, and code quality checks.
Working with medical imaging data and understanding medical imaging workflows.
Familiarity with healthcare data standards and ontologies, such as DICOM, HL7, FHIR.
Familiarity with healthcare data privacy, such as HIPAA and/or GDPR.

Professionalism: Oral and Written
Gather initial requirements, analyze clinical data, design and develop ML solutions, perform feasibility testing of proposed solutions, evaluate and interpret the results.
Transfer knowledge, expertise, and methodologies by proactively providing technical assistance to researchers and peers.
Concisely and clearly present technical and non-technical and progress updates in project meetings as well as external meetings, workshops, conferences, etc.
Communicate effectively and cooperatively with leaders, peers, end users and support teams when required.

Other duties as assigned

Education Required:
Bachelor's degree in Biomedical Engineering, Electrical Engineering, Computer Engineering, Physics, Applied Mathematics, Science, Engineering, Computer Science, Statistics, Computational Biology, or related field.

Experience Required:
Three years' experience in scientific software development/analysis.
With Master's degree, one years' experience required.
With PhD, no experience required.

Preferred Experience:
Experience with Azure, and proficiency in cloud-native tools and services such as Azure Arc, Azure ML and Azure Cognitive Compute (or similar).

It is the policy of The University of Texas MD Anderson Cancer Center to provide equal employment opportunity without regard to race, color, religion, age, national origin, sex, gender, sexual orientation, gender identity/expression, disability, protected veteran status, genetic information, or any other basis protected by institutional policy or by federal, state or local laws unless such distinction is required by law. http://www.mdanderson.org/about-us/legal-and-policy/legal-statements/eeo-affirmative-action.html

Additional Information
Requisition ID: 160432
Employment Status: Full-Time
Employee Status: Regular
Work Week: Days
Minimum Salary: US Dollar (USD) 84,500
Midpoint Salary: US Dollar (USD) 105,500
Maximum Salary : US Dollar (USD) 126,500
FLSA: exempt and not eligible for overtime pay
Fund Type: Soft
Work Location: Remote (within Texas only)
Pivotal Position: Yes
Referral Bonus Available?: Yes
Relocation Assistance Available?: Yes
Science Jobs: No

#LI-Remote
Apply Now: click Apply Now
Show Less
Report",4.1,10000+ Employees,1941,Hospital,Health Care Services & Hospitals,Healthcare,$1 to $5 billion (USD)
"Machine Learning Engineer, Prescient Design",$110K - $168K (Glassdoor est.),Genentech4.2 ★,"New York, NY","The Position
The Position
Prescient Design is developing cutting-edge machine learning for drug discovery, building new methods, techniques, and systems to fundamentally transform how drugs are designed.
The Engineering group within Prescient is looking for solid engineering skills and experience building and improving large scale distributed machine learning systems, and contributing to the science behind the models.
We know engineering plays a key role in ML advances, and we require engineers who want to build the high quality research tools and frameworks to increase the research productivity across Prescient Design. As a machine learning engineer, you will help develop and productionalize algorithms, contribute to cutting-edge research and will play a key role in Prescient Design’s success.
The group provides a dynamic and challenging environment for cutting-edge, multidisciplinary research including access to heterogeneous data sources, close links to top academic institutions around the world, as well as internal Genentech Research and Early Development (gRED) partners and research units.
In this role, you will:
Participate in cutting-edge research in machine learning and methods development with applications to drug discovery.
Build tools that enable large scale ML experiments
Solve core engineering challenges including the design, implementation, and scaling of our machine learning algorithms.
Collaborate closely with cross-functional teams across both Prescient Design and gRED to solve complex problems in the life sciences.

Qualifications
Master's Degree or Ph.D. in Computer Science or Mathematics, Applied Stats, Machine Learning or similar experience working in industry
Experience implementing large scale deep learning models.
Experience with PyTorch in a production setting.
Excellent programming skills.
Intense curiosity about molecular design and eagerness to contribute to scientific and computational efforts.
Who We Are
Genentech, a member of the Roche group and founder of the biotechnology industry, is dedicated to pursuing groundbreaking science to discover and develop medicines for people with serious and life-threatening diseases. To solve the world's most complex health challenges, we ask bigger questions that challenge our industry and the boundaries of science to transform society. Our transformational discoveries include the first targeted antibody for cancer and the first medicine for primary progressive multiple sclerosis.
Diversity and Inclusion (D&I) are critical to the success of our company and our impact on society. We believe that by championing diversity of background, thought and experience, we can foster a sense of belonging and provide an environment where every employee feels valued, included, and able to contribute their best for the patients we serve. We’re focused on attracting, retaining, developing and advancing our people to their full potential by rewarding bold ways of thinking and integrating inclusive behaviors into every aspect of our work.
The expected salary range for this position based on the primary location of New York City is $137,400 and $255,200 of hiring range. Actual pay will be determined based on experience, qualifications, geographic location, and other job-related factors permitted by law. A discretionary annual bonus may be available based on individual and Company performance. This position also qualifies for the benefits detailed at the link provided below.
Benefits
Genentech is an equal opportunity employer, and we embrace the increasingly diverse world around us. Genentech prohibits unlawful discrimination based on race, color, religion, gender, sexual orientation, gender identity or expression, national origin or ancestry, age, disability, marital status and veteran status.
Genentech requires all new hires to be fully vaccinated against COVID-19 as of their start date. This requirement is a condition of employment at Genentech, and it applies regardless of whether the position is located at a Genentech campus or is fully remote. If you are unable to receive the vaccine due to a disability or serious medical condition, or because it is prohibited as a result of your sincerely held religious beliefs, you will have an opportunity to request a reasonable accommodation.
Start your job application: click Apply Now
Show Less
Report",4.2,10000+ Employees,1976,Subsidiary or Business Segment,Biotech & Pharmaceuticals,Pharmaceutical & Biotechnology,$10+ billion (USD)
