Job Title,Salary Estimate,Company Name,Location,Job Description,Rating,Size,Founded,Type of ownership,Industry,Sector,Revenue
"Senior Software Engineer I, Machine Learning",$164K - $192K (Employer est.),Etsy4.5 ★,"Brooklyn, NY","Company Description

Etsy is the global marketplace for unique and creative goods. We build, power, and evolve the tools and technologies that connect millions of entrepreneurs with millions of buyers around the world. As an Etsy Inc. employee whether a team member of Etsy, Reverb, or Depop, you will tackle unique, meaningful, and large-scale problems alongside passionate coworkers, all the while making a rewarding impact and Keeping Commerce Human.

Job Description

What’s the role?
We are looking for a Senior Software Engineer, Machine Learning to join the International Search team at Etsy.
You will be responsible for building and maintaining search models which serve the entire non-US traffic on Etsy, while applying state of the art, large scale machine learning algorithms to improve them. Our fast paced team employs the latest research in the field to directly apply it to solve problems which benefit our buyers and sellers. Do you find joy in applying practical concepts in machine learning to solve a problem in front of you? If so, this could be the perfect match.
This is a full-time position reporting to the Engineering Manager, International Search and the base salary range will be 164,000.00 - 192,000.00 USD per year. In addition to salary, you will also be eligible for an equity package, an annual performance bonus, and our competitive benefits that support you and your family as part of your total rewards package at Etsy. This role requires your presence in Etsy’s Brooklyn office in an in-person or flex capacity. Learn more about our Flex and Office-based work modes and workplace safety policies here.
What’s this team like at Etsy?
Our team is responsible for showing buyers in our international markets relevant inventory based on their location and language. We’re a multi-functional group of engineers, designers, data scientists, researchers and product managers.
Here’s a taste of the problems we’re solving:
How can we use the latest in machine learning and information retrieval to improve our international search pipelines?
How can we use past buyer behavior or nuances in different languages to match search results that more accurately reflect a user’s intent?
How can we improve search results when buyer and seller languages don’t match?
How can we incorporate research and technology in a way which makes the most practical sense to the product?
What does the day-to-day look like?
You will work in a cross-functional team to prioritize projects which help achieve our product targets.
You will build, deploy, test and maintain scalable machine learning models by applying the latest concepts in research and industry.
You will run various A/B experiments to improve search relevance.
You will create and advance large scale ETL pipelines.
You will work closely with our product manager to help build roadmaps which range between a few weeks to 6-12 months.
Of course, this is just a sample of the kinds of work this role will require! You should assume that your role will encompass other tasks, too, and that your job duties and responsibilities may change from time to time at Etsy's discretion, or otherwise applicable with local law.

Qualifications

Qualities that will help you thrive in this role are:
You have experience developing impactful solutions to machine learning & NLP problems involving some or all of the following parts of the pipeline: data extraction, developing and training machine learning models, working the new model into production applications.
You develop data driven solutions and build scalable solutions working closely with infrastructure teams.
You have a penchant for learning new technologies and don’t hesitate to apply them to your work when required.
You turn ideas into deeply reliable and well tested code that other people – or you, six months into the future – will find easy to comprehend and modify.
You are a mindful, empathetic, and communicative member of your team.

Additional Information

What's Next
If you're interested in joining the team at Etsy, please share your resume with us and feel free to include a cover letter if you'd like. As we hope you've seen already, Etsy is a place that values individuality and variety. We don't want you to be like everyone else - we want you to be like you! So tell us what you're all about.

Our Promise
At Etsy, we believe that a diverse, equitable and inclusive workplace furthers relevance, resilience, and longevity. We encourage people from all backgrounds, ages, abilities, and experiences to apply. Etsy is proud to be an equal opportunity workplace and is an affirmative action employer. We are committed to equal employment opportunity regardless of race, color, ancestry, religion, sex, national origin, sexual orientation, age, citizenship, marital status, disability, gender identity or Veteran status. If, due to a disability, you need an accommodation during any part of the interview process, please let your recruiter know. While Etsy supports visa sponsorship, sponsorship opportunities may be limited to certain roles and skills.

For U.S. roles only:
Many Etsy roles are open to remote candidates, and you'll be able to identify which ones within the location header of each job description. We're open to remote hires from all U.S. states except Hawaii and Alaska.
Show Less
Report",4.5,1001 to 5000 Employees,2005,Company - Public,Other Retail Stores,Retail & Wholesale,$1 to $5 billion (USD)
"ASIC Engineer, Design (University Grad)",$95K - $124K (Employer est.),Meta3.9 ★,"Austin, TX","Meta is seeking an ASIC Engineer, Design to join our Infrastructure organization to build cutting edge ASICs in fields such as machine learning, video transcoding and network acceleration. This organization is responsible for building and maintaining the data centers that host all of our services - Facebook, Instagram, WhatsApp etc. These servers and data centers are the foundation upon which our rapidly scaling infrastructure efficiently operates and upon which our innovative services are delivered. In this role, you will be an integral member of an ASIC team to build accelerators for some of our top workloads enabling our data centers to scale efficiently. You will have an opportunity to work with experts in the domain of video transcode, AI/ML and other technologies to evaluate algorithms, develop functional and performance models and help architect state-of-the art hardware accelerator ASICs. Come work and learn alongside our expert engineers to build “Green” data center accelerators.


ASIC Engineer, Design (University Grad) Responsibilities:
Participate in Micro-architecture, Design, and Verification reviews and provide feedback.
Design and develop RTL or HLS code for some of the IPs.
Analyze designs and enhance PPA (Power, Performance, Area)
Support and develop Verification Infrastructure, analyze and improve Verification Coverage.
Support Simulation accelerators and post-Silicon validation.



Minimum Qualifications:
Exposure to Micro-architecture development.
Currently has, or is in the process of obtaining a Bachelor's degree in Computer Science, Computer Engineering, relevant technical field, or equivalent practical experience. Degree must be completed prior to joining Meta.
Exposure to RTL development using Verilog, System Verilog or HLS.
Knowledge of Computer Architecture and Logic Design fundamentals.
Must obtain work authorization in the country of employment at the time of hire and maintain ongoing work authorization during employment.



Preferred Qualifications:
Currently has, or is in the process of obtaining, a Masters degree in Electrical Engineering, Computer Engineering or related engineering fields
Experience in data path development.
Experience in HLS.
Experience with Lint, CDC, Synthesis, & Power Optimization.
Experience with High Performance Computing.
Scripting capability with Python or Perl.





Meta is proud to be an Equal Employment Opportunity and Affirmative Action employer. We do not discriminate based upon race, religion, color, national origin, sex (including pregnancy, childbirth, reproductive health decisions, or related medical conditions), sexual orientation, gender identity, gender expression, age, status as a protected veteran, status as an individual with a disability, genetic information, political views or activity, or other applicable legally protected characteristics. You may view our Equal Employment Opportunity notice here. We also consider qualified applicants with criminal histories, consistent with applicable federal, state and local law. We may use your information to maintain the safety and security of Meta, its employees, and others as required or permitted by law. You may view Meta's Pay Transparency Policy, Equal Employment Opportunity is the Law notice, and Notice to Applicants for Employment and Employees by clicking on their corresponding links. Additionally, Meta participates in the E-Verify program in certain locations, as required by law
To apply to this job, click Apply Now
Show Less
Report",3.9,10000+ Employees,2004,Company - Public,Internet & Web Services,Information Technology,$10+ billion (USD)
AI Research Engineer,$116K - $137K (Employer est.),Meta3.9 ★,"New York, NY","Meta is seeking a Research Engineer to join fundamental and applied research teams, which are focused on making significant progress in AI. Advances in AI are key to our mission, spanning some of the most pressing research challenges of our generation across such areas as artificial intelligence, machine learning, computational statistics, and applied mathematics, particularly including areas such as deep learning, generative models, reinforcement learning, computer perception, natural language processing. The ideal candidate will have a keen interest in producing new science to understand intelligence and technology to make computers more intelligent, or to work on more applied problems across the company.


AI Research Engineer Responsibilities:
Write clean machine learning code in Python.
Engineer, design, implement, and improve Machine Learning systems and tools for enabling research.
Collaborate on research projects within a distributed team to advance the science and technology of intelligent machines.



Minimum Qualifications:
Experience programming in Python or other related language.
Currently has, or is in the process of obtaining a Bachelor's degree in Computer Science, Computer Engineering, relevant technical field, or equivalent practical experience. Degree must be completed prior to joining Meta.
Experience using PyTorch or similar deep learning libraries.
Must obtain work authorization in the country of employment at the time of hire, and maintain ongoing work authorization during employment.



Preferred Qualifications:
Experience working with high-dimensional time series data such as audio.
Currently has, or is in the process of obtaining a Master's degree in Computer Science, Machine Learning, Data Science, relevant technical field, or equivalent practical experience.
Co-authored publications at peer-reviewed conferences (e.g. NeurIPS, ICLR, CVPR or similar).
Experience solving complex problems and comparing alternative solutions, tradeoffs, and diverse points of view to determine a path forward.
Experience working and communicating cross functionally in a team environment.
Demonstrated research and software engineering experience via an internship, work experience, coding competitions, or widely used contributions in open source repositories (e.g. GitHub).





Meta is proud to be an Equal Employment Opportunity and Affirmative Action employer. We do not discriminate based upon race, religion, color, national origin, sex (including pregnancy, childbirth, reproductive health decisions, or related medical conditions), sexual orientation, gender identity, gender expression, age, status as a protected veteran, status as an individual with a disability, genetic information, political views or activity, or other applicable legally protected characteristics. You may view our Equal Employment Opportunity notice here. We also consider qualified applicants with criminal histories, consistent with applicable federal, state and local law. We may use your information to maintain the safety and security of Meta, its employees, and others as required or permitted by law. You may view Meta's Pay Transparency Policy, Equal Employment Opportunity is the Law notice, and Notice to Applicants for Employment and Employees by clicking on their corresponding links. Additionally, Meta participates in the E-Verify program in certain locations, as required by law
Start your job application: click Apply Now
Show Less
Report",3.9,10000+ Employees,2004,Company - Public,Internet & Web Services,Information Technology,$10+ billion (USD)
Machine Learning Engineer / Data Scientist,$95K - $124K (Glassdoor est.),Ford Motor Company4.0 ★,"Dearborn, MI","In Global Data, Insight & Analytics (GDI&A), we aspire to navigate Ford Motor Company through the disruptiveness of the information age, harnessing the power of data and artificial intelligence to realize the enterprise’s known goals, reveal hidden opportunities, and achieve data superiority.

The Strategy & Enterprise Analytics team under Connected Vehicle & Enterprise Analytics organization in GDI&A leverages advanced analytics and domain expertise to deliver data analytics models, tools, and services to areas such as the Office of the General Counsel (OGC). As part of our team, you will be responsible for developing and delivering machine learning models such Classification, Time Series, LLM, etc., tools, and services to support evidence-based decision-making. You will collaborate with business partners to identify new and novel data sources and explore their potential use in developing actionable business results.

The minimum requirements we seek:
M.S. in Data Science, Business Analytics, Machine Learning, Computer Science, Electrical Engineering, Applied math, Mechanical Engineering, Industrial Engineering, or related quantitative field
4+ years of combined experience: using SQL for data querying and extraction; performing statistical analysis, regression analysis, time series analysis, clustering, classification, and predictive modeling; using machine learning algorithms and frameworks; performing data manipulation (structured & unstructured) and analysis libraries in Python; and using big data technologies or cloud-based data platforms
3+ year of experience: performing exploratory data analysis; building data flow diagrams; developing, programming, validating, and solving technical problems with AI/ML; performing vehicle or digital feature development; or delivering complex technical products
3+ year of experience of using business intelligence tools (e.g., Qlik Sense, Tableau, Looker, Streamlit, etc.) in Cloud Platform preferably GCP or AWS; developing analytical and data intelligence products in an Agile development environment
1 year of experience or certification with data warehousing and database management systems preferably using GCP suits such as BigQuery, Cloud Storage, Cloud Run, and Cloud Pub/Sub
Strong oral, written and interpersonal communication skills
Experience writing and speaking about technical concepts to business, technical, and lay audiences and giving data-driven presentations

Preferred Qualifications:
Ph.D. in Data Science, Computer Science, Electrical Engineering, Applied math, Mechanical Engineering, Industrial Engineering, or related quantitative field or 3+ years of industry experience in data science and analysis
Legal or regulatory domain experience
5+ years of experience, including both full-time work and research/academia experience, with one or more of the following tools: Data Gathering skills/tools (e.g., BigQuery, SQL, Hadoop, Spark, Teradata, etc.) and/or Visualization skills/tools (e.g., Qlik Sense, Looker, Streamlit, etc.)
5+ years of experience, including both full-time work and research/academia experience, in mathematical programming, data mining, statistical analysis, and/or machine learning
1+ year of Google Cloud Platform (GCP) experience, including certifications
Experience in one or more of the following domains: NLP, forecasting algorithms, large scale optimization, and deep learning
Ability to drive results and handle multiple projects within a given timeframe
Well-organized, independent, and ready to work with minimal supervision
Inquisitive, proactive, and interested in learning new tools and techniques
Comfortable working in a fast-paced and innovative environment where problems are not always well-defined
Publications or presentations in recognized journals or conferences
What you’ll receive in return :
As part of the Ford family, you’ll enjoy excellent compensation and a comprehensive benefits package that includes generous PTO, retirement, savings, and stock investment plans, incentive compensation, and much more. You’ll also experience exciting opportunities for professional and personal growth and recognition.
Candidates for positions with Ford Motor Company must be legally authorized to work in the United States. Verification of employment eligibility will be required at the time of hire. Visa sponsorship is available for this position.
We are an Equal Opportunity Employer committed to a culturally diverse workforce. All qualified applicants will receive consideration for employment without regard to race, religion, color, age, sex, national origin, sexual orientation, gender identity, disability status, or protected veteran status.
For information on Ford's salary and benefits, please visit: https://corporate.ford.com/content/dam/corporate/us/en-us/documents/careers/2023-benefits-and-comp-GSR-sal-plan-2.pdf

What you’ll be able to do :
Acquire deep understanding of the business problems and translate them into appropriate business solutions
Collaborate internally and externally to identify new and novel data sources and explore their potential use in developing actionable business results
Drive development and delivery of analytic and statistical models using skills such as data acquisition and management, algorithm design, and model development & refinement
Work with business partners using a collaborative, agile approach to develop solutions rapidly that add value and are centered around the user experience
Act as full stack data scientist to develop mathematical, analytical, optimization and/or AI/ML models to support evidence-based decision making. Ensure overall quality of the data & solutions throughout the analytic development process and support deploying them as end-to-end products on Google Cloud Platform
Examine, interpret and report analytical results in both written reports and in oral presentations to varied audiences
To apply to this job, click Apply Now
Show Less
Report",4.0,10000+ Employees,1903,Company - Public,Transportation Equipment Manufacturing,Manufacturing,$10+ billion (USD)
