Job Title,Salary Estimate,Company Name,Location,Job Description,Rating,Size,Founded,Type of ownership,Industry,Sector,Revenue
Data Architect,-1,FPT Software3.9 ★,Remote,"Data Architect
Job Type: Full time
Workplace: Atlanta, GA
Responsibility:
Data Operations and Analytics support to process data from Google Analytics platform to Snowflake
Provide architecture and development for a automated and continuous data pipeline from a Cox operated Google Big Query environment to a Cox operated AWS Snowflake environment
Develop transformation routines in Snowflake for ingested Google Analytics data.
Prepare design and QA plans for Above Process
Provide Google Big Query configuration assistance
Provide Data Operations orchestration for timing, alerting of the data pipeline
Learn and retain knowledge of business and team development processes
Create regular status reporting
Knowledge sharing between onshore team and between members of offshore team
Contribute to the on-going development of best practices, identification of suitable new tools and system and service improvements
Develop solutions in-line with in-house standards and practices.
Coordinate with Offshore team
Qualifications (Required):
Bachelor’s and/or master’s degree in computer science or related field
Five+ years of experience delivering high quality software products
Strong experience/working knowledge in designing architecture of with Google Big Query, Snowflake and associated data pipeline technologies
Knowledge with Google Analytics
Proven track record working on high volume, large databases that require performance tuning.
Familiarity with Jenkins/GIT dev ops
In-depth knowledge and experience of the software development lifecycle
Having experience to work/lead onsite/offshore model team.
Strong communication skills. Able to easily collaborate with peers and customers.
Technical Leadership: driving the team, work through complicated situations, problems. Get things done in very short time duration.
Experience delivering software in an Agile or Lean delivery method
Strong SQL query knowledge
Experience in production support design decisions with our business partners and the rest of the development team membersJob Description
We are looking for a Data Warehouse Architect to join our team. The Data Warehouse Architect will be responsible for designing, implementing, and maintaining data warehouse solutions. The ideal candidate will have a strong understanding of the data warehousing process and data warehouse architecture. This position will also be responsible for designing and implementing data warehouse solutions, including storage, analysis, and reporting.
Qualifications
Bachelor’s degree in Computer Science or a related field
5+ years of experience in designing, implementing, and maintaining data warehouse solutions
Experience with relational databases and ETL tools
Experience with database administration, query optimization, and ETL scripting
Experience with SSIS and reporting tools
Experience with database administration and reporting tools (e.g., SQL Server)
Experience with project management tools (e.g., Microsoft Project)
Ability to work independently with minimal supervision
Ability to work well in a team environment as well as independently
Job Type: Contract
Schedule:
8 hour shift
Application Question(s):
How much rate you expected for this position ?
Experience:
Data Architect: 5 years (Preferred)
Big Query: 4 years (Preferred)
Snowflake: 4 years (Preferred)
Work Location: Remote
Show Less
Report",3.9,10000+ Employees,1999,Company - Public,Information Technology Support Services,Information Technology,$500 million to $1 billion (USD)
Senior Data Architect,$85.00 - $90.00 Per Hour (Employer est.),Teamware Solutions (quantum leap consulting).4.5 ★,"New York, NY","Role: Azure Databricks Architect with PySpark and Snowflake exp
Location: NYC, NY (1271 Avenue of the Americas, New York, NY 10020) - 100% onsite from Day 1.
Max Rate: $90/hr on c2c
Exp level : 15+ years
Skills:
Great hands-on experience with Azure Databricks platform. Extensive experience in PySpark coding.
Excellent written and verbal communication, intellectual curiosity, a passion to understand and solve problems, consulting & customer service
Structured and conceptual mindset coupled with strong quantitative and analytical problem-solving aptitude
Exceptional interpersonal and collaboration skills within a team environment
Responsibilities:
Design, develop, and deploy Databricks jobs to process and analyze large volumes of data.
Collaborate with data engineers and data scientists to understand data requirements and implement appropriate data processing pipelines.
Optimize Databricks jobs for performance and scalability to handle big data workloads.
Monitor and troubleshoot Databricks jobs, identify and resolve issues or bottlenecks.
Implement best practices for data management, security, and governance within the Databricks environment.
Job Type: Contract
Salary: $85.00 - $90.00 per hour
Schedule:
8 hour shift
Ability to commute/relocate:
New York, NY: Reliably commute or planning to relocate before starting work (Required)
Experience:
Data modeling: 1 year (Preferred)
Work Location: In person
Show Less
Report",4.5,1001 to 5000 Employees,2003,Company - Private,Information Technology Support Services,Information Technology,Unknown / Non-Applicable
Azure Data Architect,$150K - $180K (Employer est.),Hitachi Vantara Corporation3.3 ★,Remote,"Position Overview:
We are looking for a highly skilled Azure Data Architect to join our team. As an Azure Data Architect, you will be responsible for designing and implementing scalable and efficient data architecture solutions on the Azure cloud platform. Your primary focus will be on creating robust data models, optimizing data storage and retrieval, and ensuring the overall integrity and security of data. You will collaborate with cross-functional teams to understand business requirements and translate them into effective data architecture solutions that support data-driven decision-making.

Responsibilities:
Design and implement end-to-end data architecture solutions on the Azure cloud platform.
Collaborate with business stakeholders, data engineers, and data scientists to understand data requirements and design scalable and flexible data models.
Develop data ingestion strategies and frameworks to efficiently capture and integrate data from various sources into Azure data services.
Define data storage and retrieval mechanisms, including data partitioning, indexing, and compression, to optimize performance and cost efficiency.
Implement data governance and data management practices to ensure data quality, consistency, and compliance with relevant regulations.
Create and maintain data pipelines and ETL/ELT processes to transform, cleanse, and integrate data across different data sources.
Collaborate with security and compliance teams to establish and enforce data security measures, including data encryption, access controls, and data masking.
Perform data profiling, analysis, and troubleshooting to identify and resolve data-related issues.
Stay up to date with the latest advancements in Azure data services and recommend innovative solutions to enhance data architecture capabilities.
Provide technical guidance and mentorship to junior team members and promote best practices in data architecture design and implementation.

Qualifications:
Bachelor's or Master's degree in Computer Science, Engineering, or a related field.
Extensive experience designing and implementing data architecture solutions on the Azure cloud platform.
Strong proficiency in Azure data services such as Azure SQL Database, Azure Synapse Analytics, Azure Data Lake Storage, Azure Databricks, and Azure Cosmos DB.
Deep understanding of data modeling principles and experience with relational, dimensional, and NoSQL data modeling techniques.
Solid knowledge of ETL/ELT processes, data integration patterns, and data warehouse concepts.
Familiarity with big data processing frameworks like Apache Spark or Hadoop.
Proficiency in SQL and programming languages such as Python or Scala.
Experience with data governance, data security, and compliance practices in Azure.
Strong problem-solving and analytical skills with the ability to troubleshoot and resolve complex data-related issues.
Excellent communication and collaboration skills to work effectively with stakeholders at all levels.
Ability to manage multiple projects and priorities in a fast-paced and dynamic environment.

Preferred Qualifications:
Relevant certifications in Azure or data architecture.
Experience with streaming data processing using technologies like Apache Kafka or Azure Event Hubs.
Knowledge of machine learning and AI technologies and their integration with data architecture.
Understanding of data visualization and reporting tools.
Familiarity with DevOps practices and CI/CD pipelines in the context of data architecture.
As required by the equal pay and transparency acts, the expected base salary for this position is $150k-$180k + Bonus+ Benefits
The expected pay is determined based on a variety of factors including, but not limited to, depth of experience in the practice area. Employees are eligible to participate in Hitachi Vantara's bonus/variable/commission pay programs, where applicable, and are subject to the program's conditions and restrictions.
Our Company
Hitachi Vantara is part of the Global Hitachi family. We balance innovation with an open, friendly culture and the backing of a long-established parent company, known for its ethical reputation. We guide customers from what's now to what's next by unlocking the value of their data and applications to solve their digital challenges, achieving outcomes that benefit both business and society.
Our people are our biggest asset, they drive our innovation advantage and we strive to offer a flexible and collaborative workplace where they can thrive. Diversity of thought is welcomed and our employee base is represented by several active Employee Resource Group communities. We offer industry leading benefits packages (flexible working, generous pension and private healthcare) and promote a creative and inclusive culture. If driving real change gives you a sense of pride and you are passionate about powering social good, we'd love to hear from you.
Our Values
We strive to create an inclusive environment for all and are open to considering home working, compressed/flexible hours and flexible arrangements. Get in touch with us to explore how we might be able to accommodate your specific needs.
We are proud to say we are an equal opportunity employer and welcome all applicants for employment without attention to race, colour, religion, sex, sexual orientation, gender identity, national origin, veteran or disability status. With Japanese roots going back over 100 years, our culture is founded on the values of our parent company expressed as the Hitachi Spirit:
Wa – Harmony, Trust, Respect
Makoto – Sincerity, Fairness, Honesty, Integrity
Kaitakusha-Seishin – Pioneering Spirit, Challenge
#LI-MS2
To apply to this job, click Apply Now
Show Less
Report",3.3,10000+ Employees,1989,Subsidiary or Business Segment,Information Technology Support Services,Information Technology,Unknown / Non-Applicable
Data Warehouse Architect,$84K - $117K (Glassdoor est.),Intellibee Inc4.5 ★,"Lansing, MI","Job Title: Data Warehouse Architect
Location: Lansing, MI
Designs, implements and supports data warehousing.
Implements business rules via stored procedures, middleware, or other technologies.
Defines user interfaces and functional specifications.
Responsible for verifying accuracy of data, and the maintenance and support of the data warehouse.
Knowledge of data warehouse end-to-end implementation processes, from business requirement logical modeling, physical database design, ETL, end-user tools, database, SQL, performance tuning.
Demonstrated problem resolution skills with team of persons, and strong leadership with implementation team.
Experience in data warehouse design and data modeling (both relational and dimensional) and development and maintenance of multi-dimensional data models.
Development experience in implementation of data warehousing utilizing RDBMS.
Understanding of data warehouse Metadata concepts, tools and different data warehouse methodologies.
Expertise in SQL and proficiency in database tuning techniques.
Responsible for the ongoing architecture and design of the data warehouse, data mart, and reporting environments.
Develop strategies for flexibility and scalability, and define the future technical architecture direction for the business intelligence reporting physical environment.
Relies on experience and judgment to plan and accomplish goals, independently performs a variety of complicated tasks, a wide degree of creativity and latitude is expected.
Responsible for proper selection of appropriate hardware, software, tools and system lifecycle techniques for the different components of the end-to-end data warehouse architecture including ETL, metadata, data profiling software, database platform, performance monitoring, reporting and analytic tools.
Defining and documenting the technical architecture of the data warehouse, including the physical components and their functionality.
Setting or enforcing standards and overall architecture for data warehouse systems.
Monitoring the data warehousing industry and assisting in establishing the organization's data warehousing strategy and section of strategic warehousing tools and techniques.
Ensuring compatibility of the different components of the DW architecture and ensuring alignment with broader IT strategies and goals.
Ability to educate the project teams on the standards and architecture of each component of the data warehouse architecture.
Very strong written and oral communication skills, including some presentation skills.
Years of experience: 8 or more years of experience in the field
Roles and Responsibilities:
Participates in designing, developing and refining the client Azure database services to ensure that it is secure, reliable, and robust. Implements changes to the Azure environment to increase performance and efficiencies.
Develops and implements detection and disaster recovery activities to test Azure services; participates in detecting, investigating, documenting, and reporting actual or potential Azure environment security violations, intrusions, failures, performance or other issues.
Designs Azure data migration backbone infrastructure, to provide reliable, optimized, high performance cloud services.
Design CEDS (Common Education Data Standard) complaint database and data structure in Azure environment.
Evaluates security products and tests security systems performance; assists in planning, implementing, and testing disaster recovery procedures; participates in making formal risk assessments related to the client Azure environment.
Required:
TSQL: 10+ Years
PowerShell: 6+ Years
Azure DevOps: 6+ Years
Scrum: 6+ Years
Job Types: Full-time, Contract
Schedule:
8 hour shift
Experience:
Data modeling: 5 years (Preferred)
TSQL: 10 years (Preferred)
PowerShell: 6 years (Preferred)
Azure DevOps: 6 years (Preferred)
Scrum: 6 years (Preferred)
Work Location: On the road
Show Less
Report",4.5,1 to 50 Employees,-1,Company - Public,-1,-1,Unknown / Non-Applicable
"Software Engineer, Data Products",$119K - $163K (Glassdoor est.),LaunchDarkly4.1 ★,"Oakland, CA","Please note, before progressing to our application, this position is based in the San Francisco Bay Area and not suitable for remote candidates.
About the Job:
We are looking for exceptional Software Engineers to make a profound impact on how data products will be integrated into companies' software in the future. We are integrating data into everything LaunchDarkly offers on top of our unrivaled feature management platform.
As a Data Products - Software Engineer, you will help us architect and write fast, reliable, and scalable data processing tools to process data from our thousands of customers and their hundreds of millions of users around the world. We're looking for someone who knows what it takes to deliver value to customers and takes pride in the quality of their work.
The primary technologies we use daily include Golang, Scala, Kinesis, and Flink. If working as a part of such a poly-functional team to bring to change how experimentation is done forever appeals to you then come join the Experimentation team at LaunchDarkly.
Responsibilities:
Build and expand our data platform and services
Help us identify the best technologies for our evolving data needs
Collaborate with product team to spec and deliver user-facing features
Monitor and improve data pipeline performance
Actively participate in code reviews
Improve engineering standards, tooling, and processes
Qualifications:
Proven experience and fluency in a JVM or functional language
Experience building data platforms (e.g. using Flink, Kafka, DataFlow, Hadoop, Spark)
Strong communication skills, a positive attitude, and empathy
You write code that can be easily understood by others, with an eye towards maintainability
You hold yourself and others to a high bar when working with production systems
You value high code quality, automated testing, and other engineering best practices
Pay:
Target pay range for a Level P3 in San Francisco/Bay Area: $144,000 - $169,000*
Restricted Stock Units (RSUs), health, vision, and dental insurance, and mental health benefits in addition to salary.
LaunchDarkly operates from a place of high trust and transparency; we are happy to state the pay range for our open roles to best align with your needs. Exact compensation may vary based on skills, experience, degree level, and location.
About LaunchDarkly:
LaunchDarkly is a Feature Management Platform that serves trillions of feature flags daily to help software teams build better software, faster. Feature flagging is an industry standard methodology of wrapping a new or risky section of code or infrastructure change with a flag. Each flag can easily be turned off independent of code deployment (aka ""dark launching""). LaunchDarkly has SDKs for all major web and mobile platforms. We are building a diverse team so that we can offer robust products and services. Our team culture is dynamic, friendly, and supportive. Our headquarters are in Oakland.
At LaunchDarkly, we believe in the power of teams. We're building a team that is humble, open, collaborative, respectful and kind. We are an equal opportunity employer and value diversity at our company. We do not discriminate on the basis of race, religion, color, national origin, gender, gender identity, sexual orientation, age, marital status, veteran status, or disability status.
One of our company values is 'Widen the Circle'. Which means we seek out diversity of perspectives to get better results. We understand everyone has their own unique talents and experiences. We encourage you to apply to this role even if you don’t think you meet 100% of the qualifications outlined above. We can find out together if it's the right match for your skillset.
We've partnered with KeyValues to help demonstrate the amazing culture we've built here at LaunchDarkly, find more info at https://www.keyvalues.com/launchdarkly.
LaunchDarkly is also committed to giving back to our community and is a part of Pledge 1%, an organization that helps companies make this a priority. Through this initiative and its charitable arm, the LaunchDarkly Foundation, the company is committed to such causes as supporting education for the underserved, homelessness relief and moving towards having a net-zero carbon footprint. You can find more about the LaunchDarkly Foundation and the organizations we serve at https://launchdarkly.com/foundation/.
Do you need a disability accommodation?
Fill out this accommodations request form and someone from our People Operations team will contact you for assistance.
Show Less
Report",4.1,501 to 1000 Employees,2014,Company - Private,Enterprise Software & Network Solutions,Information Technology,$100 to $500 million (USD)
GCP Data Modeler/ Architect,$70.00 Per Hour (Employer est.),Infinity Quest4.0 ★,"Dublin, OH","Qualifications & Experience
Required
· Must have designed, developed, and supported a complex software solution.
· Proficient in SQL.
· Good Understanding in dimensional/multidimensional data modeling.
· Experience with graph, transactional, and operational data modeling is a plus.
· Familiarity with all stages of the product development cycle. Experience maintaining engineering best practices, including defect tracking, design reviews, and appropriate testing.
· Hold strong organizational and problem-solving skills.
· Take a pragmatic, product-oriented approach.
· Possess the ability to work cross-functionally with minimal supervision.
Preferred
· B.S. in Computer Science, Electrical Engineering, Mathematics, Statistics, Physics, or similar quantitative fields/work experience.
· Experience with cloud environments
· 7+ years of experience in data modeling.
· 3-7+ years of experience in at least one scripting language (Python, Perl, JavaScript, Shell)
· 2+ years of experience working on streaming data applications
· 3+ years of experience with Agile engineering practices
· 3+ years of experience developing Java-based software solutions, scripting and OOP languages
· 3+ years of experience with UNIX/Linux, including basic commands and shell scripting
· 2+ years of experience with GCP
· 1+ years in the healthcare industry and knowledge of their business practices.
Job Type: Contract
Salary: From $70.00 per hour
Schedule:
8 hour shift
Experience:
Data modeling: 1 year (Required)
Python: 1 year (Required)
DVT: 1 year (Required)
Data Validation Tool: 1 year (Required)
Terraform: 1 year (Required)
BigQuery: 1 year (Required)
Work Location: On the road
Show Less
Report",4.0,201 to 500 Employees,2006,Company - Private,Information Technology Support Services,Information Technology,Unknown / Non-Applicable
Data Architect,$70.00 - $75.00 Per Hour (Employer est.),American Unit Inc4.3 ★,Remote,"Hello,
My name is James work as a Technical Recruiter at American Unit Inc.
Below is the Job Description, If you are interested please share me your updated resume along with the contact details to james@americanunit.comor call me at (214) 286 5251.
Role: Data Architect with PBM (Pharmacy Benefit Management)
Location: Remote
Duration: Long term Contract
Client: LTI Mindtree/ UHG (United Health Group Inc)
Job Description:
Looking for Pharmacy Benefit Management / Part -D Data Architecture and Data Domain Experience.
Looking for someone who has actually worked with a PBM such as express script caremark OntumRx Medlmanct, Prime Therapeutics, Argus Health or other Tier 2 Pharmacy Benefit Administrator.
Data Architecture, Data Engineering, Data Management, Cloud Data Management etc. with a PBM client asap.
Roles and Responsibilities:
· Lead successful delivery of Centene – PBM NBI Medicaid Plans Implementationsacross 21 US States, Commercial Plans, Centene Employee Benefits & Ambetter Exchanges Plans Implementations, SHARP Healthcare, Health Partners Plans of PA, and Anthem Medicaid Plans Implementations
· NBI Implementation direct discussions with Centene PBM Stakeholders
· Managing the delivery of NBI [New Business Implementation] & MOB [Maintenance of Benefits] cases on daily basis
· Defect Manager in setting up War room calls, collaborate with all primary stakeholders such as BRMs, Clinical Team, Coders, Pharmacy and Network Pricing Team, Testing Team, CVS Health RxClaim IT Team etc. to bring out the issues on to closure
· Daily Scrum and Operations call status with Client Stakeholders
· Prepare RTM to track against Requirements
· Prepare Issues Report
· Collaboration with multi-vendor onshore and offshore team
· Analyze Production Correction Issues and present RCAs
· Present RCA Improvement action plan to improve quality standards
· Mentoring and training project members to enable them to perform their activities effectively
Thanks & Regards
James
Sr.Technical Recruiter
American Unit, Inc
2901 Dallas Pkwy, Suite 333, Plano, TX -75093
✉: james@americanunit.com;
☎: +1 (214) 286 5251
: https://www.linkedin.com/in/james-au-111914229/
http://www.americanunit.com
Job Type: Contract
Salary: $70.00 - $75.00 per hour
Experience:
Pharmacy Benefit Management: 1 year (Required)
Work Location: Remote
Speak with the employer
+91 8977644995
Show Less
Report",4.3,201 to 500 Employees,2003,Company - Private,Enterprise Software & Network Solutions,Information Technology,$25 to $100 million (USD)
Big Data Architect,$93K - $166K (Employer est.),PSRTEK4.5 ★,"Denver, CO","Role: Data Architect
Location: Denver CO, (Day 1 Onsite)
Job Description
Big Data Architect experienced to Manage the Data with core foundational Data Architecture knowledge (12 to 15+yrs)
Data Archival, taxonomy, classification, Tagging,
Business Cataloging
Access control to Data
Data Governance
Data Management
Data Archival
Build Business glossary
Build Metadata
AWS Technologies skills or any cloud technologies a plus
Job Type: Contract
Salary: $92,559.20 - $165,638.64 per year
Ability to commute/relocate:
Denver, CO 80014: Reliably commute or planning to relocate before starting work (Required)
Experience:
Big Data: 10 years (Preferred)
Work Location: In person
Speak with the employer
+91 609-934-3291
Show Less
Report",4.5,Unknown,-1,Company - Private,Information Technology Support Services,Information Technology,Unknown / Non-Applicable
