Job Title,Salary Estimate,Company Name,Location,Job Description,Rating,Size,Founded,Type of ownership,Industry,Sector,Revenue
Data Engineer,$70K - $140K (Employer est.),CVS Health3.1 ★,"Irving, TX","Assists in the development of large-scale data structures and pipelines to organize, collect and standardize data that helps generate insights and addresses reporting needs

Applies understanding of key business drivers to accomplish own work

Uses expertise, judgment and precedents to contribute to the resolution of moderately complex problems

Leads portions of initiatives of limited scope, with guidance and direction

Writes ETL (Extract / Transform / Load) processes, designs database systems and develops tools for real-time and offline analytic processing

Collaborates with client team to transform data and integrate algorithms and models into automated processes

Uses knowledge in Hadoop architecture, HDFS commands and experience designing & optimizing queries to build data pipelines

Uses programming skills in Python, Java or any of the major languages to build robust data pipelines and dynamic systems

Builds data marts and data models to support clients and other internal customers

Integrates data from a variety of sources, assuring that they adhere to data quality and accessibility standards

Pay Range
The typical pay range for this role is:
Minimum: 70,000
Maximum: 140,000

This pay range represents the base hourly rate or base annual full-time salary for all positions in the job grade within which this position falls. The actual base salary offer will depend on a variety of factors including experience, education, geography and other relevant factors. This position is eligible for a CVS Health bonus, commission or short-term incentive program in addition to the base pay range listed above.

In addition to your compensation, enjoy the rewards of an organization that puts our heart into caring for our colleagues and our communities. The Company offers a full range of medical, dental, and vision benefits. Eligible employees may enroll in the Company's 401(k) retirement savings plan, and an Employee Stock Purchase Plan is also available for eligible employees. The Company provides a fully-paid term life insurance plan to eligible employees, and short-term and long term disability benefits. CVS Health also offers numerous well-being programs, education assistance, free development courses, a CVS store discount, and discount programs with participating partners. As for time off, Company employees enjoy Paid Time Off (PTO) or vacation pay, as well as paid holidays throughout the calendar year. Number of paid holidays, sick time and other time off are provided consistent with relevant state law and Company policies.

For more detailed information on available benefits, please visit
jobs.CVSHealth.com/benefits

Required Qualifications
1+ years of progressively complex related experience

Experience with bash shell scripts, UNIX utilities & UNIX Commands

Preferred Qualifications
Ability to leverage multiple tools and programming languages to analyze and manipulate data sets from disparate data sources

Ability to understand complex systems and solve challenging analytical problems

Strong problem-solving skills and critical thinking ability

Strong collaboration and communication skills within and across teams

Knowledge in Java, Python, Hive, Cassandra, Pig, MySQL or NoSQL or similar

Knowledge in Hadoop architecture, HDFS commands and experience designing & optimizing queries against data in the HDFS environment

Experience building data transformation and processing solutions

Has strong knowledge of large-scale search applications and building high volume data pipelines

Education
Bachelor's degree or equivalent work experience in Computer Science, Engineering, Machine Learning, or related discipline

Master’s degree or PhD preferred

Business Overview
Bring your heart to CVS Health Every one of us at CVS Health shares a single, clear purpose: Bringing our heart to every moment of your health. This purpose guides our commitment to deliver enhanced human-centric health care for a rapidly changing world. Anchored in our brand — with heart at its center — our purpose sends a personal message that how we deliver our services is just as important as what we deliver. Our Heart At Work Behaviors™ support this purpose. We want everyone who works at CVS Health to feel empowered by the role they play in transforming our culture and accelerating our ability to innovate and deliver solutions to make health care more personal, convenient and affordable. We strive to promote and sustain a culture of diversity, inclusion and belonging every day. CVS Health is an affirmative action employer, and is an equal opportunity employer, as are the physician-owned businesses for which CVS Health provides management services. We do not discriminate in recruiting, hiring, promotion, or any other personnel action based on race, ethnicity, color, national origin, sex/gender, sexual orientation, gender identity or expression, religion, age, disability, protected veteran status, or any other characteristic protected by applicable federal, state, or local law. We proudly support and encourage people with military experience (active, veterans, reservists and National Guard) as well as military spouses to apply for CVS Health job opportunities.
Start your job application: click Apply Now
Show Less
Report",3.1,10000+ Employees,1963,Company - Public,Health Care Services & Hospitals,Healthcare,$10+ billion (USD)
Machine Learning Engineer - Computer Vision,$129K - $195K (Employer est.),TikTok3.5 ★,"Seattle, WA","Responsibilities
TikTok is the leading destination for short-form mobile video. Our mission is to inspire creativity and bring joy. TikTok has global offices including Los Angeles, New York, London, Paris, Berlin, Dubai, Mumbai, Singapore, Jakarta, Seoul and Tokyo.

Why Join Us
At TikTok, our people are humble, intelligent, compassionate and creative. We create to inspire - for you, for us, and for more than 1 billion users on our platform. We lead with curiosity and aim for the highest, never shying away from taking calculated risks and embracing ambiguity as it comes. Here, the opportunities are limitless for those who dare to pursue bold ideas that exist just beyond the boundary of possibility. Join us and make impact happen with a career at TikTok.

Our Trust and Safety engineering team is fast growing and responsible for building machine learning models and systems to identify and defend internet abuse and fraud on our platform. Our mission is to protect billions of users and publishers across the globe every day. We embrace the state-of-the-art machine learning technologies and scale them to detect and improve the tremendous amount of data generated on the platform. With the continuous efforts from our team, TikTok is able to provide the best user experience and bring joy to everyone in the world.

We are looking for excellent machine learning engineers who can take initiatives, design and develop advanced machine learning solutions, and deploy them directly to TikTok's global platform. A successful candidate will have machine learning expertise and good software engineering experience. And you will take pride in working with engineers, product managers and business partners to identity and solve the most challenging safety and integrity problems in the internet scale.

Responsibilities - What You'II Do
Lead to build the trust and safety machine learning production models
Work on image classifiers, object detectors, video understanding models, multi-modal classifiers, etc.
Work with engineering teams to implement model pipeline and deploy the service at scale
Collaborate with product teams to define objectives and improve trust and safety strategy
Collaborate with data analysts to understand and find data patterns
Qualifications
This opening is for both junior level and senior level. Minimum requirement is a BS degree with 3+ years’ industrial experience, or a MS/PhD degree with 1+ years' relevant experience
Hands on experience in one or more of the areas: image classification, object detection, video understanding, motion analysis or multi-modal modeling
Good programming skills in Python and similar languages, and a deep understanding of data structures and algorithms
Good communication and teamwork skills, be passionate about learning new techniques and taking on challenging problems
Experience in trust and safety and/or publications in top conferences are plus
TikTok is committed to creating an inclusive space where employees are valued for their skills, experiences, and unique perspectives. Our platform connects people from across the globe and so does our workplace. At TikTok, our mission is to inspire creativity and bring joy. To achieve that goal, we are committed to celebrating our diverse voices and to creating an environment that reflects the many communities we reach. We are passionate about this and hope you are too.

TikTok is committed to providing reasonable accommodations during our recruitment process. If you need assistance or an accommodation, please reach out to us at usrc@tiktok.com.
Job Information
The base salary range for this position in the selected city is $129200 - $194750 annually.



Compensation may vary outside of this range depending on a number of factors, including a candidate’s qualifications, skills, competencies and experience, and location. Base pay is one part of the Total Package that is provided to compensate and recognize employees for their work, and this role may be eligible for additional discretionary bonuses/incentives, and restricted stock units.



At ByteDance/TikTok our benefits are designed to convey company culture and values, to create an efficient and inspiring work environment, and to support ByteDancers to give their best in both work and life. We offer the following benefits to eligible employees:



We cover 100% premium coverage for employee medical insurance, approximately 75% premium coverage for dependents and offer a Health Savings Account(HSA) with a company match. As well as Dental, Vision, Short/Long term Disability, Basic Life, Voluntary Life and AD&D insurance plans. In addition to Flexible Spending Account(FSA) Options like Health Care, Limited Purpose and Dependent Care.



Our time off and leave plans are: 10 paid holidays per year plus 17 days of Paid Personal Time Off(PPTO) (prorated upon hire and increased by tenure) and 10 paid sick days per year as well as 12 weeks of paid Parental leave and 8 weeks of paid Supplemental Disability.



We also provide generous benefits like mental and emotional health benefits through our EAP and Lyra. A 401K company match, gym and cellphone service reimbursements. The Company reserves the right to modify or change these benefits programs at any time, with or without notice.
Start your job application: click Apply Now
Show Less
Report",3.5,1001 to 5000 Employees,2016,Company - Private,Internet & Web Services,Information Technology,Unknown / Non-Applicable
"Software Engineer, Search",$130K - $250K (Employer est.),Notion4.8 ★,"New York, NY","About Us:
We're on a mission to make it possible for every person, team, and company to be able to tailor their software to solve any problem and take on any challenge. Computers may be our most powerful tools, but most of us can't build or modify the software we use on them every day. At Notion, we want to change this with focus, design, and craft.
We've been working on this together since 2016, and have customers like Pixar, Mitsubishi, Figma, Plaid, Match Group, and thousands more on this journey with us. Today, we're growing fast and excited for new teammates to join us who are the best at what they do. We're passionate about building a company as diverse and creative as the millions of people Notion reaches worldwide.
Notion is an in-person company, and currently requires its employees to come to the office for two Anchor Days (Mondays & Thursdays) and requests that employees spend the majority of their week in the office (including a third day).
About The Role:
Notion is looking for talented search engineers to join our search team. The team owns designing and building the systems to power search and discovery in the product. You will delight our users by helping define and improve our approach to full-text indexing, retrieval, ranking, personalization and recommendations.
What You'll Achieve:
You’ll build best-in-class search and discovery systems used by millions of users across billions of documents
You’ll improve search latency and relevancy using large scale data systems and machine learning
You’ll build our search-as-a-service platform to speed up the development process of other engineering teams
You’ll work with Product, Design and your engineering peers to build and deliver on a longterm and impactful roadmap for search and discovery
Skills You'll Need to Bring:
You have experience in backend engineering, data infrastructure, search infrastructure or natural language processing/machine learning
You have a track record for shipping scalable and reliable user-facing products
You thrive when collaborating cross-functionally — especially with product, design, infrastructure or data teams
You have a computer science background or equivalent technical experience
Nice to Haves:
You have experience building full-text search (e.g Lucene, Elasticsearch, Solr or other proprietary solutions) or recommendation systems
You have experience building fully productionized machine learning systems
You have experience with designing, building and maintaining complex distributed systems
You have experience with large scale data processing technologies (e.g. Spark, Flink, Kafka, Airflow, YARN/Hadoop)
You are interested in experimenting with new search technologies such as text similarity / vector search and deep learning ranking models
You have worked at a fast-growing start-up, a SaaS company, or are eager to contribute in such an environment (being a current Notion user would be great!)
You've heard of computing pioneers like Ada Lovelace, Douglas Engelbart, Alan Kay, and others—and understand why we're big fans of their work.
Our customers come from all walks of life and so do we. We hire great people from a wide variety of backgrounds, not just because it's the right thing to do, but because it makes our company stronger. If you share our values and our enthusiasm for small businesses, you will find a home at Notion.
Notion is proud to be an equal opportunity employer. We do not discriminate in hiring or any employment decision based on race, color, religion, national origin, age, sex (including pregnancy, childbirth, or related medical conditions), marital status, ancestry, physical or mental disability, genetic information, veteran status, gender identity or expression, sexual orientation, or other applicable legally protected characteristic. Notion considers qualified applicants with criminal histories, consistent with applicable federal, state and local law. Notion is also committed to providing reasonable accommodations for qualified individuals with disabilities and disabled veterans in our job application procedures. If you need assistance or an accommodation made due to a disability, please let your recruiter know. Notion is committed to providing highly competitive cash compensation, equity, and benefits. The compensation offered for this role will be based on multiple factors such as location, the role’s scope and complexity, and the candidate’s experience and expertise, and may vary from the range provided below. For roles based in New York, the estimated base salary range for this role is $130,000 - $250,000 per year.
#LI-Onsite
Show Less
Report",4.8,201 to 500 Employees,2016,Company - Private,Enterprise Software & Network Solutions,Information Technology,Unknown / Non-Applicable
Machine Learning Scientist I,$95K - $136K (Glassdoor est.),Cambia Health Solutions3.5 ★,"Portland, OR","Machine Learning Scientist I
Flexible within OR, WA, ID or UT
Cambia Health Solutions is working to create a seamless and frictionless health care experience for consumers nationwide. This presents a unique challenge and opportunity for innovative solutions that serve patients and providers and influence the healthcare system. Cambia’s AI team builds, prototypes, and deploys data-driven models and algorithms to production systems, delivering more equitable, effective, and affordable health care to our members.
We are seeking a talented and skilled Machine Learning Scientist to join us and help advance our current and future work applying machine learning, deep learning, and NLP to deliver better health care. We contribute broadly across Cambia, working on a wide range of challenging problems, for instance:
Reducing our members’ claim costs using both supervised and unsupervised approaches.
Speeding up prior authorizations and appeals using NLP to understand clinical notes.
Personalizing member engagement to promote the health and well-being of our members.
Driving health equity across Cambia initiatives.
And much more!
As a Machine Learning Scientist, you will play a vital role in understanding requirements, prototyping and building models, conducting experiments, and driving innovative solutions. Your passion for machine learning, deep learning, and NLP, coupled with your eagerness to learn and grow, will be instrumental in advancing Cambia’s data-driven initiatives.
Qualifications & Requirements:
Academic degree (master's or PhD preferred) in Data Science, Computer Science, Statistics, or a related quantitative field.
Machine learning: Strong mathematical foundation and understanding of the concepts underlying machine learning, deep learning, NLP, statistical modeling, and data analysis. Familiarity with common machine learning frameworks and libraries such as TensorFlow, PyTorch, scikit-learn, XGBoost, etc. Understanding of standard algorithms (e.g., search & sort) and data structures, and their analysis.
NLP: Familiarity in NLP and fundamental understandings of using LLM and NLP libraries like NLTK, spaCy, or Hugging Face transformers is a plus.
Model development and evaluation: Experience (academic or professional) applying a variety of ML techniques and approaches to solve problems. Strong foundation in model evaluation, including metric development and selection.
Data preprocessing and analysis: Understanding of how to structure machine learning pipelines. Familiarity with data preprocessing techniques and tools. Experience with SQL and/or python data processing libraries (e.g., Pandas, NumPy).
Analytical mindset: Strong analytical thinking and problem-solving abilities to contribute to data analysis and experimental evaluations. Attention to detail and an eagerness to learn from experimental results.
Communication and teamwork: Good communication skills to collaborate effectively with cross-functional teams. Willingness to collaborate and learn with team members.
Healthcare knowledge: Previous experience is beneficial but not required.
Responsibilities:
Model prototyping and development: Work with other ML Scientists to use machine learning, deep learning, and NLP to prototype, develop, and refine models on top of our ML platform, leveraging best practices and established frameworks. Implement algorithms and techniques to meet requirements and objectives of specific business problems.
Experimentation and evaluation: Conduct experiments and evaluations to assess the performance and effectiveness of different models and techniques. Develop metrics that reflect the needs of the business for their use cases. Analyze experimental results, interpret findings, and provide actionable recommendations.
Model deployment and productionization: Work with ML Scientists and ML Engineers to optimize and adapt models for real-time, scalable, and efficient performance. Collaborate with engineering and infrastructure teams to ensure seamless integration and deployment of models into production systems.
Requirement analysis and solution design: Collaborate with cross-functional teams to understand business requirements, define clear objectives, and develop technical plans. Work with stakeholders to identify opportunities where machine learning techniques can provide valuable insights and solutions.
Data preprocessing and feature engineering: Implement robust and reusable data preprocessing and feature engineering pipelines to extract meaningful insights from raw data. Clean, transform, and prepare datasets to facilitate effective model training and evaluation.
Continuous learning and innovation: Stay updated with the latest advancements in machine learning, deep learning, and NLP, particularly as applied in healthcare. Explore and evaluate new algorithms, frameworks, and tools to enhance model performance and efficiency.
Work Environment
Work primarily performed in a hybrid environment consisting of in-office and working from home.
Travel may be required, locally or out of state.
The base pay annual salary range for this job is $100,500 - $164,000.
Base pay is just part of the compensation package at Cambia that is supplemented with an exceptional 401(k) match, bonus opportunity and other benefits. In keeping with our Cause and vision, we offer comprehensive well-being programs and benefits, which we periodically update to stay current. Some highlights:
medical, dental, and vision coverage for employees and their eligible family members
annual employer contribution to a health savings account ($1,200 or $2,500 depending on medical coverage, prorated based on hire date)
paid time off varying by role and tenure in addition to 10 company holidays
up to a 6% company match on employee 401k contributions, with a potential discretionary contribution based on company performance (no vesting period)
up to 12 weeks of paid parental time off (eligible day one of employment if within first 12 months following birth or adoption)
one-time furniture and equipment allowance for employees working from home
up to $225 in Amazon gift cards for participating in various well-being activities. for a complete list see our
External Total Rewards
page.
We are an Equal Opportunity and Affirmative Action employer dedicated to workforce diversity and a drug and tobacco-free workplace. All qualified applicants will receive consideration for employment without regard to race, color, national origin, religion, age, sex, sexual orientation, gender identity, disability, protected veteran status or any other status protected by law. A background check is required.
If you need accommodation for any part of the application process because of a medical condition or disability, please email
CambiaCareers@cambiahealth.com
. Information about how Cambia Health Solutions collects, uses, and discloses information is available in our
Privacy Policy
. As a health care company, we are committed to the health of our communities and employees during the COVID-19 pandemic. Please review the policy on our
Careers
site.
Show Less
Report",3.5,5001 to 10000 Employees,1917,Nonprofit Organization,Health Care Services & Hospitals,Healthcare,Unknown / Non-Applicable
